{
  "$schema": "./schema/game-config.schema.json",
  "id": "halls-of-valhalla",
  "name": "Halls of Valhalla",
  "theme": "norse",
  "description": "1024 ways beneath the World Tree. Land three bonus symbols and the gods decide who leads your Ragnarök Free Spins.",
  "layout": "ways",
  "reels": 5,
  "rows": 4,
  "volatility": "high",
  "tags": [
    "new",
    "hot"
  ],
  "betLevels": [
    20,
    40,
    100,
    200,
    400,
    1000,
    2000,
    5000
  ],
  "defaultBet": 100,
  "targetRtp": {
    "min": 0.94,
    "max": 0.97
  },
  "symbols": [
    {
      "id": "fehu",
      "name": "Fehu Rune",
      "kind": "low",
      "pays": {
        "3": 0.15,
        "4": 0.25,
        "5": 0.65
      }
    },
    {
      "id": "uruz",
      "name": "Uruz Rune",
      "kind": "low",
      "pays": {
        "3": 0.15,
        "4": 0.25,
        "5": 0.65
      }
    },
    {
      "id": "thurisaz",
      "name": "Thurisaz Rune",
      "kind": "low",
      "pays": {
        "3": 0.15,
        "4": 0.4,
        "5": 0.8
      }
    },
    {
      "id": "ansuz",
      "name": "Ansuz Rune",
      "kind": "low",
      "pays": {
        "3": 0.25,
        "4": 0.4,
        "5": 1.05
      }
    },
    {
      "id": "shield",
      "name": "Shield",
      "kind": "high",
      "pays": {
        "3": 0.4,
        "4": 0.8,
        "5": 1.95
      }
    },
    {
      "id": "axe",
      "name": "Axe",
      "kind": "high",
      "pays": {
        "3": 0.5,
        "4": 1.05,
        "5": 2.6
      }
    },
    {
      "id": "horn",
      "name": "Mead Horn",
      "kind": "high",
      "pays": {
        "3": 0.65,
        "4": 1.55,
        "5": 3.9
      }
    },
    {
      "id": "valkyrie",
      "name": "Valkyrie",
      "kind": "high",
      "pays": {
        "3": 1.05,
        "4": 2.6,
        "5": 6.5
      }
    },
    {
      "id": "wild",
      "name": "Yggdrasil Wild",
      "kind": "wild"
    },
    {
      "id": "bonus_odin",
      "name": "Odin",
      "kind": "scatter"
    },
    {
      "id": "bonus_thor",
      "name": "Thor",
      "kind": "scatter"
    },
    {
      "id": "bonus_loki",
      "name": "Loki",
      "kind": "scatter"
    }
  ],
  "reelSets": {
    "base": [
      {
        "fehu": 136,
        "uruz": 136,
        "thurisaz": 23,
        "ansuz": 20,
        "shield": 75,
        "axe": 12,
        "horn": 48,
        "valkyrie": 6,
        "bonus_odin": 3,
        "bonus_thor": 3,
        "bonus_loki": 3
      },
      {
        "fehu": 26,
        "uruz": 26,
        "thurisaz": 122,
        "ansuz": 109,
        "shield": 14,
        "axe": 61,
        "horn": 9,
        "valkyrie": 34,
        "wild": 9,
        "bonus_odin": 3,
        "bonus_thor": 3,
        "bonus_loki": 3
      },
      {
        "fehu": 136,
        "uruz": 136,
        "thurisaz": 23,
        "ansuz": 20,
        "shield": 75,
        "axe": 12,
        "horn": 48,
        "valkyrie": 6,
        "wild": 9,
        "bonus_odin": 3,
        "bonus_thor": 3,
        "bonus_loki": 3
      },
      {
        "fehu": 26,
        "uruz": 26,
        "thurisaz": 122,
        "ansuz": 109,
        "shield": 14,
        "axe": 61,
        "horn": 9,
        "valkyrie": 34,
        "wild": 9,
        "bonus_odin": 3,
        "bonus_thor": 3,
        "bonus_loki": 3
      },
      {
        "fehu": 136,
        "uruz": 136,
        "thurisaz": 23,
        "ansuz": 20,
        "shield": 75,
        "axe": 12,
        "horn": 48,
        "valkyrie": 6,
        "wild": 9,
        "bonus_odin": 2,
        "bonus_thor": 2,
        "bonus_loki": 2
      }
    ],
    "free": [
      {
        "fehu": 136,
        "uruz": 136,
        "thurisaz": 24,
        "ansuz": 20,
        "shield": 82,
        "axe": 12,
        "horn": 54,
        "valkyrie": 8,
        "bonus_odin": 2,
        "bonus_thor": 2,
        "bonus_loki": 2
      },
      {
        "fehu": 26,
        "uruz": 26,
        "thurisaz": 122,
        "ansuz": 108,
        "shield": 16,
        "axe": 68,
        "horn": 10,
        "valkyrie": 40,
        "wild": 17,
        "bonus_odin": 2,
        "bonus_thor": 2,
        "bonus_loki": 2
      },
      {
        "fehu": 136,
        "uruz": 136,
        "thurisaz": 24,
        "ansuz": 20,
        "shield": 82,
        "axe": 12,
        "horn": 54,
        "valkyrie": 8,
        "wild": 17,
        "bonus_odin": 2,
        "bonus_thor": 2,
        "bonus_loki": 2
      },
      {
        "fehu": 26,
        "uruz": 26,
        "thurisaz": 122,
        "ansuz": 108,
        "shield": 16,
        "axe": 68,
        "horn": 10,
        "valkyrie": 40,
        "wild": 17,
        "bonus_odin": 2,
        "bonus_thor": 2,
        "bonus_loki": 2
      },
      {
        "fehu": 136,
        "uruz": 136,
        "thurisaz": 24,
        "ansuz": 20,
        "shield": 82,
        "axe": 12,
        "horn": 54,
        "valkyrie": 8,
        "wild": 17,
        "bonus_odin": 2,
        "bonus_thor": 2,
        "bonus_loki": 2
      }
    ]
  },
  "params": {
    "wild": "wild",
    "scatters": {
      "odin": "bonus_odin",
      "thor": "bonus_thor",
      "loki": "bonus_loki"
    },
    "freeSpins": {
      "3": 10,
      "4": 12,
      "5": 15
    },
    "retrigger": {
      "scatters": 3,
      "spins": 5
    },
    "maxFreeSpins": 50,
    "maxWinX": 10000,
    "odin": {
      "ravens": [
        {
          "value": 0,
          "weight": 15
        },
        {
          "value": 1,
          "weight": 30
        },
        {
          "value": 2,
          "weight": 28
        },
        {
          "value": 3,
          "weight": 17
        },
        {
          "value": 4,
          "weight": 7
        },
        {
          "value": 5,
          "weight": 3
        }
      ],
      "reels": [
        1,
        2,
        3,
        4
      ]
    },
    "thor": {
      "multipliers": [
        {
          "value": 1,
          "weight": 5
        },
        {
          "value": 2,
          "weight": 18
        },
        {
          "value": 3,
          "weight": 20
        },
        {
          "value": 5,
          "weight": 25
        },
        {
          "value": 10,
          "weight": 19
        },
        {
          "value": 25,
          "weight": 13
        }
      ]
    },
    "loki": {
      "cells": [
        {
          "value": 0,
          "weight": 28
        },
        {
          "value": 4,
          "weight": 32
        },
        {
          "value": 5,
          "weight": 26
        },
        {
          "value": 7,
          "weight": 14
        }
      ],
      "targets": {
        "fehu": 3,
        "uruz": 3,
        "thurisaz": 3,
        "ansuz": 3,
        "shield": 4,
        "axe": 4,
        "horn": 3,
        "valkyrie": 2
      }
    }
  }
}